{
  "$schema": "https://json-schema.org/draft/2020-12/schema",
  "$id": "urn:sylvia:schema:import-handoff-manifest:v1",
  "title": "Import handoff manifest",
  "description": "handoff.json, the share extension's commit record in the App Group inbox (plan 6.1, 8.1; ADR-0010). The extension streams every item into <inbox>/<handoff_id>/items/, syncs it, and writes this file last, atomically (temporary file, F_FULLFSYNC, rename without replace, directory sync). It reports receipt only after that. A handoff directory without this file is incomplete by definition and is never imported. Rules the schema cannot express and readers must enforce: handoff_id equals the name of the directory holding the file; stored_path values and item_id values are unique; total_bytes is the sum of byte_count; the items directory holds exactly the listed files, each a regular file whose size and SHA-256 match. original_filename is metadata only and is never used as a path. The file is private to the app and its extension, never leaves the device, and holds no credential.",
  "type": "object",
  "required": ["schema_version", "handoff_id", "created_at", "producer", "items", "total_bytes"],
  "properties": {
    "schema_version": { "const": 1 },
    "handoff_id": {
      "description": "UUID generated by the extension; also the handoff directory's name.",
      "type": "string",
      "format": "uuid"
    },
    "created_at": { "type": "string", "format": "date-time" },
    "producer": {
      "type": "object",
      "required": ["kind", "bundle_identifier", "build_version"],
      "properties": {
        "kind": { "const": "share_extension" },
        "bundle_identifier": { "type": "string", "minLength": 1, "maxLength": 255 },
        "build_version": { "type": "string", "minLength": 1, "maxLength": 64 }
      }
    },
    "items": {
      "type": "array",
      "minItems": 1,
      "maxItems": 100,
      "items": { "$ref": "#/$defs/item" }
    },
    "total_bytes": {
      "description": "Sum of every item's byte_count, in bytes.",
      "type": "integer",
      "minimum": 0
    }
  },
  "$defs": {
    "item": {
      "type": "object",
      "required": [
        "item_id",
        "stored_path",
        "original_filename",
        "content_type",
        "byte_count",
        "sha256",
        "representation",
        "provider_type_identifier"
      ],
      "properties": {
        "item_id": { "type": "string", "format": "uuid" },
        "stored_path": {
          "description": "Relative to the handoff directory: items/<ordinal> with an optional lowercase alphanumeric extension. Generated by the extension, never derived from the shared file name beyond its sanitized extension.",
          "type": "string",
          "pattern": "^items/[0-9]{1,4}(\\.[a-z0-9]{1,16})?$"
        },
        "original_filename": {
          "description": "The shared file's name, for display only. At most 255 UTF-8 bytes (readers check bytes; maxLength here counts characters).",
          "type": "string",
          "minLength": 1,
          "maxLength": 255,
          "pattern": "^[^/\\u0000]+$"
        },
        "content_type": {
          "description": "Uniform type identifier of the supported type the item was received as (EPUB, PDF, plain text, Markdown or audio).",
          "type": "string",
          "minLength": 1,
          "maxLength": 128
        },
        "byte_count": { "type": "integer", "minimum": 0 },
        "sha256": {
          "description": "Lowercase hex SHA-256 of the stored bytes, computed while streaming the copy.",
          "type": "string",
          "pattern": "^[0-9a-f]{64}$"
        },
        "representation": {
          "description": "file_representation: an NSItemProvider file representation of a supported type. file_url: a public.file-url item the extension could read.",
          "enum": ["file_representation", "file_url"]
        },
        "provider_type_identifier": {
          "description": "The type identifier the item was loaded with.",
          "type": "string",
          "minLength": 1,
          "maxLength": 128
        }
      }
    }
  }
}
