{
  "created_at": "2026-10-06T02:00:00Z",
  "handoff_id": "0B3C5E9A-6D2F-4C1B-9E8A-7F6D5C4B3A21",
  "items": [
    {
      "byte_count": 733307,
      "content_type": "public.xxxxxxxxxxxxxxxxxxxxxxxxxxxxxxxxxxxxxxxxxxxxxxxxxxxxxxxxxxxxxxxxxxxxxxxxxxxxxxxxxxxxxxxxxxxxxxxxxxxxxxxxxxxxxxxxxxxxxxxxx",
      "item_id": "5E0D7C1A-2B3F-4A9C-8D7E-6F5A4B3C2D10",
      "original_filename": "ééééééééééééééééééééééééééééééééééééééééééééééééééééééééééééééééééééééééééééééééééééééééééééééééééééééééééééééééééééééééééééé.epub",
      "provider_type_identifier": "public.xxxxxxxxxxxxxxxxxxxxxxxxxxxxxxxxxxxxxxxxxxxxxxxxxxxxxxxxxxxxxxxxxxxxxxxxxxxxxxxxxxxxxxxxxxxxxxxxxxxxxxxxxxxxxxxxxxxxxxxxx",
      "representation": "file_representation",
      "sha256": "c2b77e9daa37694b978f78f9ae2d801fd263be533af187e8b36b7da28845e0c8",
      "stored_path": "items/0.epub"
    }
  ],
  "producer": {
    "build_version": "9999999999999999999999999999999999999999999999999999999999999999",
    "bundle_identifier": "com.xxxxxxxxxxxxxxxxxxxxxxxxxxxxxxxxxxxxxxxxxxxxxxxxxxxxxxxxxxxxxxxxxxxxxxxxxxxxxxxxxxxxxxxxxxxxxxxxxxxxxxxxxxxxxxxxxxxxxxxxxxxxxxxxxxxxxxxxxxxxxxxxxxxxxxxxxxxxxxxxxxxxxxxxxxxxxxxxxxxxxxxxxxxxxxxxxxxxxxxxxxxxxxxxxxxxxxxxxxxxxxxxxxxxxxxxxxxxxxxxxxxxxxxxxxx",
    "kind": "share_extension"
  },
  "schema_version": 1,
  "total_bytes": 733307
}
