{
  "created_at": "2026-10-06T01:54:26Z",
  "handoff_id": "90BD3BE6-3F11-4D72-B3C5-D3A850AE47EC",
  "items": [
    {
      "byte_count": 997147,
      "content_type": "org.idpf.epub-container",
      "item_id": "4F194E7B-B717-4031-9160-FC39D05CE58F",
      "original_filename": "se-walden.epub",
      "provider_type_identifier": "public.file-url",
      "representation": "file_url",
      "sha256": "6168a788b950aae3e778bfe9e176feda5d948453ca0050cf00ba9e706d7332ae",
      "stored_path": "items/0.epub"
    },
    {
      "byte_count": 1441009,
      "content_type": "public.mp3",
      "item_id": "3ECC7D2A-2C1B-4FFE-B6F7-A81586454EF1",
      "original_filename": "meditations-01-first180s.mp3",
      "provider_type_identifier": "public.file-url",
      "representation": "file_url",
      "sha256": "6a3b752cc744ccb310a6d71149b96a7f29d632e35ca5a6ad8abb3e46c532a1ad",
      "stored_path": "items/1.mp3"
    }
  ],
  "producer": {
    "build_version": "1",
    "bundle_identifier": "com.jevidon.sylvia.spike.intake.tool",
    "kind": "share_extension"
  },
  "schema_version": 1,
  "total_bytes": 2438156
}
